{
  "$schema": "./activation-contracts.schema.json",
  "version": 1,
  "scope": "customer-portal-wave9-runtime-program/S5",
  "allowedDispositions": ["local", "fixture", "opened_live", "unavailable", "not_opened"],
  "healthControlSet": ["rbac", "consent", "audit", "secureViewerOrDownload", "leastData"],
  "repositorySearch": {
    "root": ".",
    "excluded": [".git/**", "app-templates/customer-portal/design-inbox/**", "app-templates/customer-portal/dist/**"],
    "result": "No repository-proven non-PIM Care endpoint, command, auth/permission, idempotence, or readback contract exists. Core PIM remains the only opened live portal adapter.",
    "provenLiveException": "app-templates/customer-portal/runtime/src/adapters/core-pim-adapter.js"
  },
  "dataSources": [
    {
      "id": "care.fixture",
      "kind": "data_source",
      "owner": "care",
      "surfaces": ["authenticated-portal"],
      "fixtureShape": "careFixtures[vertical] -> {kind, content fields}; protected async import",
      "normalizer": "runtime/src/normalizers/care.js#normalizeCare",
      "endpoint": {"status": "none", "url": null, "evidence": "runtime/src/adapters/care-fixture-adapter.js"},
      "auth": ["session", "customer-scope", "tenant-scope", "care-entitlement", "fixture-data-mode"],
      "healthSecurity": {"sensitive": false, "required": ["rbac", "leastData"], "missing": [], "note": "Reference fixture payload only: logistics metadata, protected before import, with no live Health IO or document contents."},
      "concurrency": "module-owned keyed load generation; stale loads discarded",
      "successReadback": "state.moduleData.care normalized payload envelope",
      "errorFallback": "explicit disabled, unauthorized, loading, empty, or error envelope; never fixture fallback in live mode",
      "disposition": "fixture",
      "networkPolicy": "same-origin static fixture module after successful preflight",
      "trace": ["runtime/src/modules/index.js#carePreflight", "runtime/src/adapters/care-fixture-adapter.js", "runtime/src/portal-runtime.js"]
    },
    {
      "id": "care.live",
      "kind": "data_source",
      "owner": "care",
      "surfaces": ["authenticated-portal"],
      "fixtureShape": "would have to normalize to the existing Care envelope; no raw live DTO is proven",
      "normalizer": "runtime/src/normalizers/care.js#normalizeCare",
      "endpoint": {"status": "absent", "url": null, "evidence": "repo-wide S5 non-PIM contract search"},
      "auth": ["unknown live session transport", "unknown customer/tenant authorization", "unknown entitlement contract"],
      "healthSecurity": {"sensitive": true, "required": ["rbac", "consent", "audit", "secureViewerOrDownload", "leastData"], "missing": ["rbac", "consent", "audit", "secureViewerOrDownload", "leastData"], "note": "No Health live payload can be requested until every control is repository-proven."},
      "concurrency": "not defined because the live source is closed",
      "successReadback": "absent",
      "errorFallback": "preflight reason live-adapter-not-opened; content remains null",
      "disposition": "not_opened",
      "networkPolicy": "none",
      "trace": ["runtime/src/modules/index.js#carePreflight", "runtime/src/modules/index.js#careModule.adapter"]
    },
    {
      "id": "seo.reference",
      "kind": "data_source",
      "owner": "seo-reference-parity",
      "surfaces": ["portal-parity", "noindex-reference-preview"],
      "fixtureShape": "SEO[vertical] + theme + footer",
      "normalizer": "runtime/src/normalizers/seo.js#normalizeSeoReference",
      "endpoint": {"status": "none", "url": null, "evidence": "runtime/data/seo-fixtures.js"},
      "auth": ["none; explicitly reference-only"],
      "healthSecurity": {"sensitive": false, "required": [], "missing": [], "note": "Marketing reference content only."},
      "concurrency": "synchronous immutable fixture normalization",
      "successReadback": "rendered reference-only model and DOM hooks",
      "errorFallback": "normalization throws; never promoted to public authored content",
      "disposition": "fixture",
      "networkPolicy": "none",
      "trace": ["runtime/src/modules/seo.js#loadSeoModel", "runtime/src/routes/SeoLandingPage.js"]
    },
    {
      "id": "seo.publicAuthored",
      "kind": "data_source",
      "owner": "seo-public",
      "surfaces": ["public-seo-document"],
      "fixtureShape": "complete CMS-authored deployment + metadata + content payload",
      "normalizer": "runtime/src/normalizers/seo.js#normalizeSeoPublic",
      "endpoint": {"status": "cms-authored-document", "url": "explicit canonical and allowlisted destinations from authored payload", "evidence": "scripts/generate-seo-public.mjs"},
      "auth": ["none; public document"],
      "healthSecurity": {"sensitive": false, "required": [], "missing": [], "note": "Public marketing content; no clinical or portal data."},
      "concurrency": "deterministic synchronous generation; no client data load",
      "successReadback": "server-visible HTML metadata/content and validated canonical URL",
      "errorFallback": "generation fails closed on missing or invalid authored fields/URLs",
      "disposition": "local",
      "networkPolicy": "document delivery plus explicitly authored media/navigation URLs only",
      "trace": ["cms/seo-public-root-template.html", "scripts/generate-seo-public.mjs", "runtime/src/normalizers/seo.js#normalizeSeoPublic"]
    }
  ],
  "surfaceControls": [
    {"id":"care.hvac.care.selectUnit","surface":"care:hvac","action":"care.selectUnit","entities":["unit-furnace-01","unit-ac-01"],"disposition":"local","effect":"select normalized equipment unit","readback":"careSelectedUnitId + active DOM state","networkPolicy":"none","healthSecurity":{"sensitive":false,"required":[],"missing":[]}},
    {"id":"care.hvac.booking.open","surface":"care:hvac","action":"booking.open","entities":["_"],"disposition":"unavailable","effect":"disabled before interaction; booking confirm contract absent","readback":"none","networkPolicy":"none","healthSecurity":{"sensitive":false,"required":[],"missing":[]}},
    {"id":"care.hvac.care.download","surface":"care:hvac","action":"care.download","entities":["doc-hvac-diag-2026-01","doc-hvac-warranty-carrier"],"disposition":"unavailable","effect":"disabled before interaction; document destination absent","readback":"none","networkPolicy":"none","healthSecurity":{"sensitive":false,"required":[],"missing":[]}},
    {"id":"care.snow.order.open","surface":"care:snow","action":"order.open","entities":["#SV-3290","#SV-3290","#SV-3290","#SV-3290","#SV-3290"],"disposition":"local","effect":"open existing fixture order detail","readback":"route order.detail + currentOrderId","networkPolicy":"none","healthSecurity":{"sensitive":false,"required":[],"missing":[]}},
    {"id":"care.snow.care.download","surface":"care:snow","action":"care.download","entities":["doc-snow-compliance-2025-12","doc-snow-compliance-2025-11"],"disposition":"unavailable","effect":"disabled before interaction; document destination absent","readback":"none","networkPolicy":"none","healthSecurity":{"sensitive":false,"required":[],"missing":[]}},
    {"id":"care.lawn.service.requestExtra","surface":"care:lawn","action":"service.requestExtra","entities":["_"],"disposition":"unavailable","effect":"disabled before interaction; request/booking command absent","readback":"none","networkPolicy":"none","healthSecurity":{"sensitive":false,"required":[],"missing":[]}},
    {"id":"care.pool.service.requestExtra","surface":"care:pool","action":"service.requestExtra","entities":["_"],"disposition":"unavailable","effect":"disabled before interaction; request/booking command absent","readback":"none","networkPolicy":"none","healthSecurity":{"sensitive":false,"required":[],"missing":[]}},
    {"id":"care.roofing.care.download","surface":"care:roofing","action":"care.download","entities":["doc-roof-inspection-2026-01","doc-roof-warranty-shingle","doc-roof-insurance-pack"],"disposition":"unavailable","effect":"disabled before interaction; document destination absent","readback":"none","networkPolicy":"none","healthSecurity":{"sensitive":false,"required":[],"missing":[]}},
    {"id":"care.pest.care.requestRetreat","surface":"care:pest","action":"care.requestRetreat","entities":["plan-shield-2026"],"disposition":"fixture","effect":"entity-keyed fixture request transition","readback":"submitting -> submitted + retreat-card state","networkPolicy":"none","healthSecurity":{"sensitive":false,"required":[],"missing":[]}},
    {"id":"care.health.order.reschedule","surface":"care:health","action":"order.reschedule","entities":["#SV-2410"],"disposition":"unavailable","effect":"disabled before interaction; Health scheduling contract absent","readback":"none","networkPolicy":"none","healthSecurity":{"sensitive":true,"required":["rbac","consent","audit","secureViewerOrDownload","leastData"],"missing":["rbac","consent","audit","secureViewerOrDownload","leastData"]}},
    {"id":"care.health.order.open","surface":"care:health","action":"order.open","entities":["#SV-2410"],"disposition":"unavailable","effect":"disabled before interaction; cross-module Health detail controls incomplete","readback":"none","networkPolicy":"none","healthSecurity":{"sensitive":true,"required":["rbac","consent","audit","secureViewerOrDownload","leastData"],"missing":["rbac","consent","audit","secureViewerOrDownload","leastData"]}},
    {"id":"care.health.care.completeTask","surface":"care:health","action":"care.completeTask","entities":["task-health-01","task-health-02","task-health-03"],"disposition":"local","effect":"toggle fixture logistics task","readback":"careTasksDone + aria-pressed + row state","networkPolicy":"none","healthSecurity":{"sensitive":false,"required":["rbac","leastData"],"missing":[]}},